{
  "apiVersion": "alpha.platform.registry/v0.1",
  "kind": "HttpActionProfile",
  "metadata": {
    "profileId": "hap-crm-task-create",
    "profileRevisionId": "haprev-crm-task-create-001",
    "workspaceId": "wsp-alpha-demo",
    "appId": "app-work-queue-sync",
    "capabilityRef": "crm-task-create",
    "displayName": "Create one CRM task",
    "description": "Create a bounded task in the approved CRM project using the configured Workspace connection.",
    "status": "approved"
  },
  "resolution": {
    "candidateDigest": "sha256:6868686868686868686868686868686868686868686868686868686868686868",
    "sourceAppVersionId": "aver-work-queue-sync-003",
    "capabilityDefinitionDigest": "sha256:6969696969696969696969696969696969696969696969696969696969696969",
    "profileSchemaVersion": "0.1.0",
    "profileSchemaDigest": "sha256:7070707070707070707070707070707070707070707070707070707070707070",
    "registry": {
      "snapshotId": "registry-2026-09-17.1",
      "digest": "sha256:7171717171717171717171717171717171717171717171717171717171717171"
    },
    "policy": {
      "snapshotId": "policy-wsp-alpha-active-005",
      "digest": "sha256:7272727272727272727272727272727272727272727272727272727272727272"
    },
    "classifiedByServiceId": "svc-action-profile-review",
    "approvedByPrincipalId": "user-alpha-owner",
    "approvalDecisionId": "apd-hap-crm-task-create-001",
    "reviewedAt": "2026-09-17T12:00:00Z",
    "expiresAt": "2026-12-16T12:00:00Z"
  },
  "spec": {
    "capability": "http.request",
    "destination": {
      "scheme": "https",
      "host": "api.example-crm.com",
      "port": 443,
      "pathTemplate": "/v1/projects/{projectId}/tasks",
      "pathParameterNames": [
        "projectId"
      ],
      "queryParameterNames": [],
      "method": "POST",
      "redirectPolicy": "deny"
    },
    "request": {
      "schemaDigest": "sha256:7373737373737373737373737373737373737373737373737373737373737373",
      "mediaTypes": [
        "application/json"
      ],
      "allowedHeaders": [
        "content-type"
      ],
      "forbiddenBodyPointers": [
        "/isAdmin",
        "/permissions",
        "/role"
      ],
      "maximumBytes": 65536
    },
    "response": {
      "schemaDigest": "sha256:7474747474747474747474747474747474747474747474747474747474747474",
      "mediaTypes": [
        "application/json"
      ],
      "allowedHeaders": [
        "content-type",
        "etag",
        "location"
      ],
      "maximumBytes": 262144
    },
    "materialEffect": {
      "effectClass": "E3",
      "action": "create",
      "titleTemplate": "Create task in project {project-id}",
      "description": "Create one task with the reviewed title and assignee in the approved CRM project.",
      "materialFacts": [
        {
          "id": "project-id",
          "label": "Project",
          "role": "target",
          "source": "path-parameter",
          "selector": "projectId",
          "valueType": "identifier",
          "classification": "internal",
          "required": true,
          "display": true
        },
        {
          "id": "assignee-id",
          "label": "Assignee",
          "role": "target",
          "source": "body",
          "selector": "/assigneeId",
          "valueType": "identifier",
          "classification": "internal",
          "required": true,
          "display": true
        },
        {
          "id": "task-title",
          "label": "Task title",
          "role": "effect",
          "source": "body",
          "selector": "/title",
          "valueType": "string",
          "classification": "internal",
          "required": true,
          "display": true
        }
      ]
    },
    "deliverySafety": {
      "mode": "idempotency-header",
      "headerName": "idempotency-key",
      "providerRetentionSeconds": 2592000
    },
    "limits": {
      "maxCallsPerRun": 20,
      "maxCallsPerHour": 100,
      "maxCallsPerDay": 500,
      "maxItemsPerCall": 1,
      "maxItemsPerDay": 500,
      "timeoutSeconds": 30
    },
    "connection": {
      "connectionRef": "crm-api",
      "connector": "http.oauth2",
      "connectorDefinitionDigest": "sha256:7575757575757575757575757575757575757575757575757575757575757575",
      "requiredScopes": [
        "tasks.write"
      ],
      "classificationCeiling": "confidential"
    },
    "reversibility": {
      "mode": "compensatable",
      "capturesPriorState": false,
      "compensation": {
        "profileId": "hap-crm-task-delete",
        "profileRevisionId": "haprev-crm-task-delete-001",
        "profileDigest": "sha256:7676767676767676767676767676767676767676767676767676767676767676"
      }
    },
    "approval": {
      "baseline": "first-use",
      "bindingApprovalTtlSeconds": 2592000,
      "thresholds": [
        {
          "metric": "calls-per-run",
          "materialFactRef": null,
          "operator": "gt",
          "value": 10,
          "raiseTo": "always"
        }
      ]
    }
  }
}
